singlish_news,transliterated_l1,transliterated_l2,man_written
"badulla - passara, 13-kanuwa pradeshaye-di, bus rathayak adi 200ka pamana prapathayakata peralimen 10-kata adika pirisakata thuwala.: police","බඩුල්ල - පස්සර , 13 - කනුව ප්‍රඩෙශයෙ - ඩි , බුස් රතයක් අඩි 200ක පමණ ප්‍රපතයකට පෙරලිමෙන් 10 - කට අඩික පිරිසකට තුවල .: police","බදුල්ල - පස්සර , 13 - කනුව ප්‍රදේශයේ - ඩි , බුෂ් රථයක් අඩි 200ක පමණ ප්‍රපතයකට පෙරළිමෙන් 10 - කට අධික පිරිසකට තුවල . : police","බදුල්ල-පස්සර, 13 කනුව කණුව ප්‍රදේශයේදී බස් රථයක් අඩි 200 ක පමණ ප්‍රපාතයකට පෙරළීමෙන් දහයකට අධික පිරිසකට තුවාල - Police "
westminster mahesthrath adhikaranaye theenduwa brithanya mahahikaranaya nishpraba karai,වෙස්ට්මින්ස්ටෙර් මහෙස්ත්‍රත් අඩ්හිකරනයෙ තීඳුව බ්‍රිතන්ය මහහිකරනය නිශ්ප්‍රබ කරඉ,වෙස්ට්මිනිස්ටර් මහෙස්ත්‍රත් අඩ්හිකරනයෙ තීඳුව බ්‍රිතන්ය මහහිකරනය නිෂ්ප්‍රභ කරයි,westminster මහේස්ත්‍රාත් අධිකරණයේ තීන්දුව බ්‍රිතාන්‍ය මහාධිකරණය නිශ්ප්‍රභා කරයි 
london sri lanka maha komasaris karyalaye hitapu arakshaka upadeshaka major general priyanka fernandota erehi,ලොඳොන් sri ලන්ක මහ කොමසරිස් කර්යලයෙ හිටපු ආරක්ෂකක උපඩෙශක මජොර් general ප්‍රියන්ක fඑර්නඳොට එරෙහි ,ලොඳොන් sri ලන්ක මහ කොමසාරිස් කර්යලයෙ හිටපු ආරක්ෂක උපදේශක මජොර් general ප්‍රියංක fඑර්නඳොට එරෙහි ,ලන්ඩන් ශ්‍රී ලංකා මහකොමසාරිස්  හිටපු ආරක්ෂක උපදේශක මේජර් ජෙනරල major general ප්‍රියංක ප්‍රනාන්දු ට එරෙහි 
" westminster mahesthrath adikaranaye theenduwa, brithanya mahadikaranaya wisin awalangu karai- hirunews.lk","වෙස්ට්මින්ස්ටෙර් මහෙස්ත්‍රත් අඩිකරනයෙ තීඳුව , බ්‍රිතන්ය මහඩිකරනය විසින් අවලඟු කරඉ - හිරුනෙව්ස් . ල්ක්","වෙස්ට්මිනිස්ටර් මහෙස්ත්‍රත් අධිකරණයේ තීඳුව , බ්‍රිතන්ය මහඩිකරනය විසින් අවලඟු කරයි - හිරුනෙව්ස් . ල්ක්", වෙස්ට්මිනිස්ටර්  මහේස්ත්‍රාත් අධිකරණයේ තීන්දුව බ්‍රිතාන්‍ය  මහධිකරණය විසින් අවලංගු කරයි -hiru news.lk
"facebook, messenger, whatsapp saha instagram samaja-maadya wala hadisi bindaweteemak: foreign media","fඅකෙබූක් , මෙස්සෙඟෙර් , ව්හට්සප්ප් සහ ඉන්ස්ටග්‍රම් සමජ - මාඩ්ය වල හඩිසි බිඳවෙටීමක් : foreign media","fඅකෙබූක් , මෙස්සෙඟෙර් , ව්හට්සප්ප් සහ ඉන්ස්ටග්‍රම් සමඟ - මාඩ්ය වල හදිසි බිඳවැටීමකට : foreign media","facebook ,messenger whatsapp  සහ instagram සමාජ මාධ්‍ය වල හදිසි බිඳවැටීමක්- foreign media"
"dakunu aprika - 125 (nuwan kulasekara 25/5) ha sl - 129/2(17.2) sl, indiyawa samaga awasan maha tharagayata","ඩකුනු අප්‍රික - 125 ( නුවන් කුලසෙකර 25 / 5 ) හා ස්ල් - 129 / 2 ( 17 . 2 ) ස්ල් , ඉඳියව සමග අවසන් මහ තරගයට","දකුණු අප්‍රික - 125 ( නුවන් කුලසෙකර 25 / 5 ) හා ස්ල් - 129 / 2 ( 17 . 2 ) ස්ල් , ඉඳියව සමග අවසන් මහ තරගයට",දකුණු අප්‍රිකා -125(නුවන් කුලසේකර 25/5) හා SL-129/2(17.2) ශ්‍රී ලංකාව ඉන්දියාව සමඟ පැවති අවසාන මහා  තරගයට
"jathika aushada niyamana adikariya(nmra) wisin ""chinese sinopharm"" ennatha sri lankawa thula hadisi bhavithaya sadaha anumethiya labadei","ජතික ඖශඩ නියමන අඩිකරිය ( න්ම්‍ර ) විසින් "" චිනෙසෙ සිනොප්හර්ම් "" එන්නත sri ලන්කව තුළ හඩිසි බ්හවිතය සඳහා අනුමෙතිය ලබඩෙඉ",ජතික ඖෂධ නියාමන අධිකාරිය ( න්ම්‍ර ) විසින් `` චිනෙසෙ සිනොප්හර්ම් `` එන්නත sri ලන්කව තුළ හදිසි බ්හවිතය සඳහා අනුමැතිය ලබඩෙඉ,"ජාතික ඖෂධ නියාමන අධිකාරිය (NMRA) විසින් ""Chinese Sinopharm"" එන්නත ශ්‍රී ලංකාව තුළ හදිසි භාවිතය සඳහා අනුමැතිය ලැබේ"
covid-19 asaditha marana 06 k wartha weemath samaga merata samastha marana 544 dakwa ihalata - saukya amathyanshaya,covid - 19 අසඩිත මරන 06 ක් වාර්තා වීමත් සමග මෙරට සමස්ත මරන 544 දක්වා ඉහලට - සෞඛ්‍ය අමාත්‍යාංශය,covid - 19 අසිත මරණ 06 ක් වාර්තා වීමත් සමග මෙරට සමස්ත මරණ 544 දක්වා ඉහලට - සෞඛ්‍ය අමාත්‍යාංශය,Covid-19 ආසාධිත මරණ 06ක් වාර්තාවීමත් සමඟ මෙරට සමස්ත මරණ 544 ක්  දක්වා ඉහලට -සෞඛ්‍ය අමාත්‍යාංශය
thawath covid-19 marana 06k wartha-wei; merata samastha marana 544 dakwa ihalata.: information department,තවත් covid - 19 මරන 06ක් වාර්තා - වෙඉ ; මෙරට සමස්ත මරන 544 දක්වා ඉහලට .: information department,තවත් covid - 19 මරණ 06ක් වාර්තා - වෙයි ; මෙරට සමස්ත මරණ 544 දක්වා ඉහලට . : information department,තවත් Covid 19 මරණ 6 ක් වාර්තා වේ. මෙරට සමස්ත මරණ 544 දක්වා ඉහළට - information department
kuliyapitiya pradeshaye budu pilimayakata haani kirime siddiyakata sekapita athadanguwata gath india jathikayeku 03/29 thek remand-police,කුලියපිටිය ප්‍රඩෙශයෙ බුඩු පිලිමයකට හානි කිරිමෙ සිඩ්ඩියකට සෙකපිට අතඩඟුවට ගත් ඉඳිඅ ජතිකයෙකු 03 / 29 තෙක් remand - police,කුලියපිටිය ප්‍රදේශයේ බුදු පිලිමයකට හානි කිරීමේ සිද්ධියකට සැකපිට අතඩඟුවට ගත් ඉඳිඅ ජාතිකයෙකු 03 / 29 තෙක් remand - police,කුලියාපිටිය ප්‍රදේශය බුදු පිළිමයකට හානි කිරීමේ සිද්ධියකට සැක පිට අත්අඩංගුවට ගත් ඉන්දියානු ජාතිකයෙකු 03/29 තෙක් රිමාන්ඩ් - police 
sa legends vs sl legends - sl legends kandayama road safety 20/20 tharangawaliye awasan maha tharangayata sudusukam labai,ස ලෙගෙඳ්ස් ව්ස් ස්ල් ලෙගෙඳ්ස් - ස්ල් ලෙගෙඳ්ස් කඳයම road safety 20 / 20 තරඟවලියෙ අවසන් මහ තරඟයට සුඩුසුකම් ලබඉ,ස ලෙගෙඳ්ස් ව්ස් ස්ල් ලෙගෙඳ්ස් - ස්ල් ලෙගෙඳ්ස් කඳයම road safety 20 / 20 තරඟාවලිය අවසන් මහ තරඟයට සුදුසුකම් ලබයි,SA Legends vs SL Legends - SL legends කණ්ඩායම road safety 20/20 තරගාවලියේ අවසාන මහා තරගයට සුදුසුකම් ලබයි 
thawath corona asadithain 144k hadhuna gane.ada dina warthawu asadithain sankayawa 298k.-rajaye prawruthi departhamenthuwa,තවත් කොරෝනා ආසාධිතයින් 144ක් හඩ්හුන ගනෙ . අඩ ඩින වාර්තාවු ආසාධිතයින් සන්කයව 298ක් .- රජයෙ ප්‍රවෘත්ති දෙපාර්තමේන්තුව,තවත් කොරෝනා ආසාධිතයින් 144ක් හඩ්හුන ගනෙ . අද දින වාර්තාවු ආසාධිතයින් සන්තකයේ 298ක් .- රජයේ ප්‍රවෘත්ති දෙපාර්තමේන්තුව,තවත් කොරෝනා ආසාධිතයින් 144ක් හඳුනාගැනේ. අද දින වනතුරු ආසාධිතයින් සංඛ්‍යාව 298ක් -රජයේ ප්‍රවෘත්ති දෙපාර්තමේන්තුව
thawath corona asadithain 154k hadhuna gane.-rajaye prawruthi departhamenthuwa,තවත් කොරෝනා ආසාධිතයින් 154ක් හඩ්හුන ගනෙ .- රජයෙ ප්‍රවෘත්ති දෙපාර්තමේන්තුව,තවත් කොරෝනා ආසාධිතයින් 154ක් හඩ්හුන ගනෙ .- රජයේ ප්‍රවෘත්ති දෙපාර්තමේන්තුව,තවත් corona කොරෝනා ආසාධිතයින් එකසිය පනස් හතරක් හඳුනා ගැනේ -රජයේ ප්‍රවෘත්ති දෙපාර්තමේන්තුව 
"heroin ,ak 47 gini awi ,unda thogayak samaga sri lankika boattu 03k,lakshadweep muhudedi indiya araksha ansha bharayata.","හෙරොඉන් , අක් 47 ගිනි අවි , උඳ තොගයක් සමග sri ලන්කික බොඅට්ටු 03ක් , ලක්ශඩ්වීප් මුහුඩෙඩි ඉඳිය ආරක්ෂක අන්ශ බ්හරයට .","හෙරොයින් , අක් 47 ගිනි අවි , උඩ තොගයක් සමග sri ලන්කික බොඅට්ටු 03ක් , ලක්ශඩ්වීප් මුහුඩෙඩි ඉඳිය ආරක්ෂක අංශ බාරයට .","හෙරොයින් ,AK 47ගිනි අවි ,උණ්ඩ තොගයක් සමග ශ්‍රී ලාංකික  බෝට්ටු තුනක් ලක්ෂද්වීප්  මුහුදේ දී ඉන්දියා ආරක්ෂක අංශය භාරයට"
thawath covid-19 asadithayin 154k wartha wei: army commander,තවත් covid - 19 අසඩිතයින් 154ක් වාර්තා වෙඉ : army commander,තවත් covid - 19 ආසාධිතයින් 154ක් වාර්තා වෙයි : army commander,තවත් covid 19 ආසාධිතයින්  154 ක් වාර්තා වෙයි- army commander
"covid-19 asadithayin 283 deneku suwaya labai.merata suwaya labaa rohalwalin pitawa giya samastha ganana 86,227 dakwa ihalata - saukya amathyanshaya","covid - 19 අසඩිතයින් 283 ඩෙනෙකු සුවය ලබඉ . මෙරට සුවය ලබා රොහල්වලින් පිටව ගිය සමස්ත ගනන 86 , 227 දක්වා ඉහලට - සෞඛ්‍ය අමාත්‍යාංශය","covid - 19 ආසාධිතයින් 283 දෙනෙකු සුවය ලබයි . මෙරට සුවය ලබා රෝහල්වලින් පිටව ගිය සමස්ත ගණන 86 , 227 දක්වා ඉහලට - සෞඛ්‍ය අමාත්‍යාංශය","covid 19 ආසාධිතයින් 283 දෙනෙකු සුවය ලබයි.මෙරට සුවය ලබා රෝහලින් පිටව ගිය සමස්ත ගණන 86,227 දක්වා ඉහලට -සෞඛ්‍ය අමාත්‍යාංශය"
test cricket tharaga 02-kakata sahabagi weema sadaha bangladesh cricket kandayama april 12 diwainata.: slc,test cricket තරග 02 - කකට සහබගි වීම සඳහා බඟ්ලඩෙශ් cricket කඳයම අප්‍රිල් 12 ඩිවඉනට .: ස්ල්ක්,test cricket තරග 02 - කකට සහබගි වීම සඳහා බඟ්ලඩෙශ් cricket කඳයම අප්‍රිල් 12 දිවයිනට . : SLC,ටෙස්ට් cricket තරග දෙකකට සහභාගි වීම සඳහා බංග්ලාදේශ් cricket කණ්ඩායම අප්‍රේල් 12 දිවයිනට - SLC
mp nalin bandara sidu kala prakashayakata adalawa raajya buddhi sewaye pradani major general suresh sallay,ම්ප් නලින් බඳර සිදු කල ප්‍රකශයකට අඩලව රාජ්ය බුඩ්ඩ්හි සෙවයෙ ප්‍රඩනි මජොර් general සුරෙශ් සල්ලය් ,ම්ප් නලින් බඳර සිදු කල ප්‍රකශයකට අඩලව රාජ්ය බුඩ්ඩ්හි සේවයේ ප්‍රඩනි මජොර් general Suresh Sallay ,Mp නලීන් බණ්ඩාර සිදුකළ ප්‍රකාශයට අදාළව රාජ්‍ය  බුද්ධි සේවා ප්‍රධානී මේජර් ජෙනරාල් Suresh Sallay 
"thawath covid-19 asadithayin 283k suwaya laba pitawa yai; suwaya labu mulu sankyawa 86,227.: epid","තවත් covid - 19 අසඩිතයින් 283ක් සුවය ලබ පිටව යඉ ; සුවය ලබු මුලු සන්ක්යව 86 , 227 .: EPID","තවත් covid - 19 ආසාධිතයින් 283ක් සුවය ලබ පිටව යයි ; සුවය ලබු මුලු සන්ක්යව 86 , 227 . : EPID","තවත් කොවිඩ් 19 ආසාධිතයින් 283 ක් සුවය ලබා පිටව යයි .  සුවය ලැබූ මුළු සංඛ්‍යාව 86,227- EPID"
mp nalin bandara sidu-kala prakashayak sambandayen raajya buddi pradani major general suresh sallay-gen cid-yata peminillak.: police spokesman,ම්ප් නලින් බඳර සිදු - කල ප්‍රකශයක් සඹඳයෙන් රාජ්ය බුඩ්ඩි ප්‍රඩනි මජොර් general සුරෙශ් සල්ලය් - ගෙන් කිඩ් - යට පෙමිනිල්ලක් .: police spokesman,ම්ප් නලින් බඳර සිදු - කල ප්‍රකශයක් සඳෙන් රාජ්ය බුද්ධි ප්‍රඩනි මජොර් general සුරේෂ් සල්ලය් - ගෙන් කිඩ් - යට පැමිණිල්ලක් . : police spokesman,Mp නලීන් බණ්ඩාර සිදුකළ සිදු කළ ප්‍රකාශය  සම්බන්ධයෙන් රාජ්‍ය බුද්ධි ප්‍රධානි මේජර් ජනරාල් suresh ගෙන් CID යට පැමිණිල්ලක්- Police Spokesman
nalin bandara kala prakashayakata erehiwa rajya buddi pradani major general suresh sallay-gen cid-ta peminillak. vimarshana erambe-police madya prakashaka,නලින් බඳර කල ප්‍රකශයකට එරෙහිව රජ්ය බුඩ්ඩි ප්‍රඩනි මජොර් general සුරෙශ් සල්ලය් - ගෙන් කිඩ් - ට පෙමිනිල්ලක් . විමර්ශන එරඹෙ - police මඩ්ය ප්‍රකශක,නලින් බඳර කල ප්‍රකශයකට එරෙහිව රජ්ය බුද්ධි ප්‍රඩනි මජොර් general සුරේෂ් සල්ලය් - ගෙන් කිඩ් - ට පැමිණිල්ලක් . විමර්ශන ඇරඹේ - police මඩ්ය ප්‍රකශක,නලීන් බණ්ඩාර කළ ප්‍රකාශයට එරෙහිව රජය රජයේ බුද්ධි පරීක්ෂන මේජර් ජෙනරාල් Suresh Sallay ගෙන් CID ට පැමිණිල්ලක් .විමර්ශන ඇරඹේ -police මාධ්‍ය ප්‍රකාශක
agramathya mahinda rajapaksa dedina raajya sancharayak sadaha bangladeshaya balaa pitathwa yai,අග්‍රාමාත්‍ය මහින්ද රජපක්ස ඩෙඩින රාජ්ය සන්චරයක් සඳහා බඟ්ලඩෙශය බලා පිටත්ව යඉ,අග්‍රාමාත්‍ය මහින්ද රාජපක්ෂ දෙදින රාජ්ය සන්චරයක් සඳහා බඟ්ලඩෙශය බලා පිටත්ව යයි,අග්‍රාමාත්‍ය මහින්ද රාජපක්ෂ දෙදින රාජ්‍ය සංචාරයක් සඳහා බංග්ලාදේශය බලා පිටත්ව යයි
allas komisama wisin pawara thibu naduwe chodana walin emathi rohitha abeygunawardena nidahas kirimata colamba mahadikaranayen niyoga.: reporter,අල්ලස් කොමිසම විසින් පවර තිබු නඩුවෙ චොඩන වලින් එමති රොහිත අබෙය්ගුනවර්ඩෙන නිඩහස් කිරිමට කොලඹ මහඩිකරනයෙන් නියොග .: රෙපොර්ටෙර්,අල්ලස් කොමිසම විසින් පවර තිබු නඩුවෙ චොඩන වලින් ඇමති රෝහිත අබෙය්ගුනවර්ඩෙන නිදහස් කිරිමට කොළඹ මහඩිකරනයෙන් නියෝග . : රෙපොර්ටෙර්,අල්ලස් කොමිසම විසින් පවරා තිබූ නඩුවේ චෝදනා වලින් ඇමති රෝහිත ඇමති රෝහිත අභයගුණවර්ධන නිදහස් කිරීමට කොළඹ මහාධිකරණයෙන් නියෝග - reporter
"isurupaya, adyapana amathyanshaya idiripita guru sangam 2ka virodhatha hethuwen pelawatta awata dhedi rathawaahana thadabadayak.: reporter","ඉසුරුපය , අඩ්යපන අමාත්‍යාංශය ඉඩිරිපිට ගුරු සඟම් 2ක විරොඩ්හත හෙතුවෙන් පෙලවට්ට අවට ඩ්හෙඩි රතවාහන තඩබඩයක් .: reporter","ඉසුරු , අඩ්යපන අමාත්‍යාංශය ඉදිරිපිට ගුරු සඟම් 2ක විරොඩ්හත හේතුවෙන් පෙලවට්ට අවට ඩ්හෙඩි වාහන තදබදයක් . : reporter",ඉසුරුපාය අධ්යාපන අධ්‍යාපන අමාත්‍යාංශය ඉදිරිපිට ගුරු සංගම් දෙකක් විරෝධතා හේතුවෙන් පැලවත්ත අවට දැඩි රථවාහන තදබදයක්- reporter
update: bangladeshaye dedina raajya sancharaya arabamin dhaka aganuwarata pemini agamethi mahinda rajapaksa erata agamethiniya wisin piligani,update : බඟ්ලඩෙශයෙ ඩෙඩින රාජ්ය සන්චරය අරබමින් ඩ්හක අගනුවරට පෙමිනි අගමෙති මහින්ද රජපක්ස එරට අගමෙතිනිය විසින් පිලිගනි,update : බඟ්ලඩෙශයෙ දෙදින රාජ්ය සන්චරය කරමින් ඩ්හක අගනුවරට පෙමිනි අගමැති මහින්ද රාජපක්ෂ එරට අගමෙතිනිය විසින් පිලිගනි,Update : බංග්ලාදේශය දෙදෙන රාජ්‍ය සංචාරය අරඹමින් ඩකා අගනුවරට පැමිණි අගමැති මහින්ද රාජපක්ෂ එරට අග්‍රාමාත්‍ය විසින් පිළිගැනේ 
allas komisama wisin pawara thibu naduwe chodana walin emathi rohitha abeygunawardena nidahas kirimata colamba mahadikaranayen niyoga.: reporter,අල්ලස් කොමිසම විසින් පවර තිබු නඩුවෙ චොඩන වලින් එමති රොහිත අබෙය්ගුනවර්ඩෙන නිඩහස් කිරිමට කොලඹ මහඩිකරනයෙන් නියොග .: reporter,අල්ලස් කොමිසම විසින් පවර තිබු නඩුවෙ චොඩන වලින් ඇමති රෝහිත අබෙය්ගුනවර්ඩෙන නිදහස් කිරිමට කොළඹ මහඩිකරනයෙන් නියෝග . : reporter,අල්ලස් කොමිසම මගින් පනවා තිබූ නඩුවේ චෝදනා වලින් ඇමති ඇමැති රෝහිත අබේගුණවර්ධන නිදහස් කිරීමට කොළඹ මහාධිකරණය මහාධිකරණය නියෝග - reporter
"isurupaya, adyapana amathyanshaya idiripita guru sangam 2ka virodhatha hethuwen pelawatta awata dhedi rathawaahana thadabadayak.: reporter","ඉසුරුපය , අඩ්යපන අමාත්‍යාංශය ඉඩිරිපිට ගුරු සඟම් 2ක විරොඩ්හත හෙතුවෙන් පෙලවට්ට අවට ඩ්හෙඩි රතවාහන තඩබඩයක් .: reporter","ඉසුරු , අඩ්යපන අමාත්‍යාංශය ඉදිරිපිට ගුරු සඟම් 2ක විරොඩ්හත හේතුවෙන් පෙලවට්ට අවට ඩ්හෙඩි වාහන තදබදයක් . : reporter",ඉසුරුපාය අධ්‍යාපන අමාත්‍යාංශය ඉදිරිපිට ගුරු සංගම් දෙකක් විරෝධතාවය හේතුවෙන් පැල වතාවට පෙලවත් අවට දැඩි රථවාහන තදබදයක්- reporter
amathya rohitha abeygunawardanata erehi allas comisame naduwe chodana walin ohu nidahas kirimata colamba mahadikaranayen niyoga,අමත්ය රොහිත අබෙය්ගුනවර්ඩනට එරෙහි අල්ලස් කොමිසමෙ නඩුවෙ චොඩන වලින් ඔහු නිඩහස් කිරිමට කොලඹ මහඩිකරනයෙන් නියොග,අමතකය රෝහිත අබෙය්ගුනවර්ඩනට එරෙහි අල්ලස් කොමිසම නඩුවෙ චොඩන වලින් ඔහු නිදහස් කිරිමට කොළඹ මහඩිකරනයෙන් නියෝග,අමාත්‍ය රෝහිත ගුණවර්ධන ට එරෙහි අල්ලස් කොමිසමේ නඩුවේ චෝදනා වලින් ඔහු නිදහස් කිරීමට කොළඹ මහා අධිකරනයෙන් නියෝග
"sabaragamuwa, dakuna, basnahira, madyama ha wayamba palathwala ethem sthanawalata 100mm wedi thada warshawak ethiwiya heki-met dept","සබරගමුව , ඩකුන , බස්නහිර , මඩ්යම හා වයඹ පලත්වල එතෙම් ස්තනවලට 100ම්ම් වැඩි තඩ වර්ශවක් එතිවිය හෙකි - මෙට් ඩෙප්ට්","සබරගමුව , දකුණ , බස්නාහිර , මඩ්යම හා වයඹ පත්ව එතෙම් ස්ථානවලට 100ම්ම් වැඩි තද වර්ණවත් ඇතිවිය හෙකි - මෙට් ඩෙප්ට්","සබරගමුව ,දකුණ, බස්නාහිර ,මධ්‍යම හා වයඹ පැතිවල ඇතැම් ස්ථානවලට 100mm දැඩි තද වර්ෂාවක් ඇති විය හැක -met dept"
