singlish_news,transliterated_l1,transliterated_l2,man_written
bangladeshaye dedina raajya sancharayaka niratha wu agramathya mahinda rajapaksa yali diwayinata,බඟ්ලඩෙශයෙ ඩෙඩින රාජ්ය සන්චරයක නිරත වු අග්‍රාමාත්‍ය මහින්ද රජපක්ස යලි ඩිවයිනට,බඟ්ලඩෙශයෙ දෙදින රාජ්ය සන්චරයක නිරත වු අග්‍රාමාත්‍ය මහින්ද රාජපක්ෂ යලි දිවයිනට,බංග්ලාදේශයේ දෙදින රාජ්‍ය රාජ්‍ය සංචාරයක නිරත වූ අග්‍රාමාත්‍ය මහින්ද රාජපක්ෂ යළි දිවයිනට
covid-19 asaditha maranayak wartha weemath samaga merata samastha marana ganana 545 dakwa ihalata - saukya amathyanshaya,covid - 19 අසඩිත මරනයක් වාර්තා වීමත් සමග මෙරට සමස්ත මරන ගනන 545 දක්වා ඉහලට - සෞඛ්‍ය අමාත්‍යාංශය,covid - 19 අසිත රථයක් වාර්තා වීමත් සමග මෙරට සමස්ත මරණ ගණන 545 දක්වා ඉහලට - සෞඛ්‍ය අමාත්‍යාංශය,covid-19 ආසාධිත මරණයක් වාර්තා වීමත් සමග මෙරට සමස්ත මරණ ගණන 545 දක්වා ඉහලට- සෞඛ්‍ය අමාත්‍යාංශය
thawath corona maranayak wartha wei. marana sankiyawa 545k dakwa ihalata. - sawkya sewa adyaksha genaral,තවත් කොරෝනා මරනයක් වාර්තා වෙඉ . මරන සන්කියව 545ක් දක්වා ඉහලට . - සව්ක්ය සෙව අධ්‍යක්ෂ ගෙනරල්,තවත් කොරෝනා දිනයක් වාර්තා වෙයි . මරණ සන්කියව 545ක් දක්වා ඉහලට . - සව්ක්ය සෙව අධ්‍යක්ෂ ගෙනරල්,තවත් කොරෝනා මරණයක් වාර්තා වෙයි. මරණ සංඛ්‍යාව 545 ක් දක්වා ඉහළට පන්සිය හතළිස් පහක් දක්වා ඉහලට- සෞඛ්‍ය සේවා අධ්‍යක්ෂ ජනරාල්
thawath covid-19 marana 01k wartha-wei; samastha marana 545 dakwa ihalata.: information department,තවත් covid - 19 මරන 01ක් වාර්තා - වෙඉ ; සමස්ත මරන 545 දක්වා ඉහලට .: information department,තවත් covid - 19 මරණ 01ක් වාර්තා - වෙයි ; සමස්ත මරණ 545 දක්වා ඉහලට . : information department,තවත් covid-19 මරණයක් වාර්තා වෙයි.; සමස්ත මරණ punci 45 දක්වා ඉහලට- information  department
thawath corona asadithin 158 k haduna gene. - rajye prawurthi departhamenthuwa,තවත් කොරෝනා අසඩිතින් 158 ක් හඳුනා ගෙනෙ . - රජ්යෙ ප්‍රවුර්ති දෙපාර්තමේන්තුව,තවත් කොරෝනා අසඩිතින් 158 ක් හඳුනා ගෙනෙ . - රජ්යෙ ප්‍රවුර්ති දෙපාර්තමේන්තුව,තවත් කොවිඩ් ආසාධිතයින් 158ක් හඳුනාගැනේ- රජයේ ප්‍රවෘත්ති දෙපාර්තමේන්තුව
"heta 09am sita peya 15k colamba 01,03,09,14 saha kaduwela-ta jala sepayuma athhituwai; colamba 02,07,08 saha 10-ta adu-peedanayak yatathe: nwsdb","හෙට 09අම් සිට පෙය 15ක් කොලඹ 01 , 03 , 09 , 14 සහ කඩුවෙල - ට ජල සෙපයුම අත්හිටුවඉ ; කොලඹ 02 , 07 , 08 සහ 10 - ට අඩු - පීඩනයක් යටතෙ : න්ව්ස්ඩ්බ්","හෙට 09අම් සිට පෙය 15ක් කොළඹ 01 , 03 , 09 , 14 සහ කඩුවෙල - ට ජල සැපයුම අත්හිටුවන ; කොළඹ 02 , 07 , 08 සහ 10 - ට අඩු - පීඩනයක් යටතේ : NWSDB","හෙට උදේ 09 සිට පැය 15ක් කොළඹවක් කොළඹ 1, 3 ,9, 14 සහ කඩුවෙලට ජල සැපයුම අත්හිටුවයි .කොළඹ 2 ,7 8 සහ දහයට 10 ට අඩු පීඩනයක් යටතේ -NWSDB"
thawath covid-19 asadithayin 158k wartha wei - army commander,තවත් covid - 19 අසඩිතයින් 158ක් වාර්තා වෙඉ - army commander,තවත් covid - 19 ආසාධිතයින් 158ක් වාර්තා වෙයි - army commander,තවත් covid 19 ආසාධිතයින් 158 ක් වාර්තා වෙයි- army commander
covid-19 asadithayin 158 deneku haduna ganne-yuda hamudapathi,covid - 19 අසඩිතයින් 158 ඩෙනෙකු හඳුනා ගන්නෙ - යුඩ හමුඩපති,covid - 19 ආසාධිතයින් 158 දෙනෙකු හඳුනා ගන්නේ - යුද හමුදාපති,covid-19 ආසාධිතයින් 158 දෙනකු හඳුනා ගැනේ- යුද හමුදාපති
dina dekakata pera corona mardana ennatha laba gath pakistana agramathyawaraya corona asadithayeku bawa haduna gene. - wides madhya,ඩින ඩෙකකට පෙර කොරෝනා මර්ඩන එන්නත ලබ ගත් පකිස්ටන අග්‍රාමාත්‍යවරය කොරෝනා අසඩිතයෙකු බව හඳුනා ගෙනෙ . - විඩෙස් මඩ්හ්ය,දින දෙකකට පෙර කොරෝනා මර්දන එන්නත ලබ ගත් පකිස්ථාන අග්‍රාමාත්‍යවරය කොරෝනා අසඩිතයෙකු බව හඳුනා ගෙනෙ . - විදෙස් මඩ්හ්ය,දින දෙකකට පෙර කොරෝනා මර්ධන එන්නත් ලබාගත් පාකිස්තාන අග්‍රාමාත්‍යවරයා කොරෝනා ආසාධිත යෙකු බව හඳුනා ගැනේ- විදෙස් මාධ්‍ය
pakistan agamathi imran khan-ta covid-19 asaditha bawata thahawuru-wei.: foreign media,පකිස්ටන් අගමති ඉම්‍රන් ක්හන් - ට covid - 19 අසඩිත බවට තහවුරු - වෙඉ .: foreign media,පිස්සන් අගමැති ඉම්රාන් ක්හන් - ට covid - 19 අසිත බවට තහවුරු - වෙයි . : foreign media,පාකිස්තාන අගමැති ඉම්රාන් ඛාන්-ට COVI- 19 ආසාධිත බවට තහවුරු වෙයි- foreign media
japanaye uthurudiga pradeshaye magnitude ekaka 7.2 ka bhu-chalanayak. miagi pradeshayata tsunami anathuru engaweeme niwedana-vides madya,ජපනයෙ උතුරුඩිග ප්‍රඩෙශයෙ මඥිටුඩෙ එකක 7 . 2 ක බ්හු - චලනයක් . මිඅගි ප්‍රඩෙශයට ට්සුනමි අනතුරු එඟවීමෙ නිවෙඩන - විඩෙස් මඩ්ය,ජපනයෙ උතුරුදිග ප්‍රදේශයේ මඥිටුඩෙ එකක 7 . 2 ක බ්හු - චලනයක් . මිඅගි ප්‍රදේශයට ට්සුනමි අනතුරු ඇඟවීමේ නිවේදන - විදෙස් මඩ්ය,ජපානයේ උත්තර දිග ප්‍රදේශයේ මැග්නටියුඩ් එකක 7.2 ක භූ චලනයක්. මියාගි ප්‍රදේශයට සුනාමි අනතුරු ඇඟවීමේ නිවේදන-විදෙස් මාධ්‍ය 
pakisthana agramathya imran khan hata covid-19 asadanaya wei - vides maadya,පකිස්තන අග්‍රාමාත්‍ය ඉම්‍රන් ක්හන් හට covid - 19 අසඩනය වෙඉ - විඩෙස් මාඩ්ය,පාකිස්තාන අග්‍රාමාත්‍ය ඉම්රාන් ක්හන් හට covid - 19 අසාදනය වෙයි - විදෙස් මාඩ්ය,පාකිස්ථාන අග්‍රාමාත්‍ය ඉම්රාන් ඛාන් හට covid- 19 ආසාදනය වෙයි -විදෙස් මාධ්‍
ada sita diwaina pura masayaka kalayak ratha wahana meheyum kriyathmaka kirimata piyawara. - police,අඩ සිට ඩිවඉන පුර මසයක කලයක් රත වහන මෙහෙයුම් ක්‍රියත්මක කිරිමට පියවර . - police,අද සිට දිවයින පුර මාසයක කාලයක් රථ වහන මෙහෙයුම් ක්‍රියත්මක කිරිමට පියවර . - police,අද සිට දිවයින පුරා මාසයක කාලයක් රත වාහන මෙහෙයුම් ක්‍රියාත්මක කිරීමට පියවර -Police
"thawath covid-19 asadithayin 239k suwaya laba pitawa yai; suwaya labu mulu sankyawa 86,466.: epid","තවත් covid - 19 අසඩිතයින් 239ක් සුවය ලබ පිටව යඉ ; සුවය ලබු මුලු සන්ක්යව 86 , 466 .: EPID","තවත් covid - 19 ආසාධිතයින් 239ක් සුවය ලබ පිටව යයි ; සුවය ලබු මුලු සන්ක්යව 86,466 . : EPID","තවත් කොවිඩ් 19 ආසාධිතයින් 239ක් සුවය ලබා පිටව යයි .සුවය ලැබූ මුළු සංඛ්‍යාව 86,466 -EPID"
beemathwa saha apariksha-kareewa riya padawana pudgalayin soya ada sita diwaina pura wishesha meheyum.: police spokesman,බීමත්ව සහ අපරික්ශ - කරීව රිය පඩවන පුඩ්ගලයින් සොය අඩ සිට ඩිවඉන පුර විශේෂ මෙහෙයුම් .: police spokesman,බීමත්ව සහ අපරික්ශ - කරීව රිය පනවන පුද්ගලයින් සොය අද සිට දිවයින පුර විශේෂ මෙහෙයුම් . : police spokesman,බීමත්ව හා අපරීක්ෂාකාරීව රිය පදවන පුද්ගලයන් සොයා අද සිට දිවයින පුරා විශේෂ මෙහෙයුම් - Police spokesman
bangladesha-srilanka rajya thanthrika sanadathwalata wasara 50k sepirima labana wasare,බඟ්ලඩෙශ - ස්‍රිලන්ක රජ්ය තන්ත්‍රික සනඩත්වලට වසර 50ක් සෙපිරිම ලබන වසරෙ,බඟ්ලඩෙශ - ස්‍රිලන්ක රජ්ය තන්ත්‍රික පනත්වලට වසර 50ක් සුපිරිම ලබන වසරේ,බංග්ලාදේශ ශ්‍රී ලංකා රාජ්‍ය තාන්ත්‍රික සම්බන්ධතා වලට වසර 50 ක් සපිරීම ලබන වසරේ
update-passara 13 kanuwa pradeshaye siduwu bus ratha anathurin miyagiya sankyawa 15k dakwa ihalata-badulla rohal adyaksha,update - පස්සර 13 කනුව ප්‍රඩෙශයෙ සිඩුවු බුස් රත අනතුරින් මියගිය සන්ක්යව 15ක් දක්වා ඉහලට - බඩුල්ල රොහල් අධ්‍යක්ෂ,update - පස්සර 13 කනුව ප්‍රදේශයේ සිදුවූ බුෂ් රථ අනතුරින් මියගිය සන්ක්යව 15ක් දක්වා ඉහලට - බදුල්ල රෝහල් අධ්‍යක්ෂ,Update : පස්සර 13 කනුව ප්‍රදේශයේ සිදු වූ බස් රථ අනතුරෙන් මිය ගිය සංඛ්‍යාව 15 ක් දක්වා ඉහලට -බදුල්ල රෝහල් අධ්‍යක්ෂ
update - passara bus anathure nawathama video darshna sadaha 11.55am-ta hiru tv balanna,update - පස්සර බුස් අනතුරෙ නවතම විඩෙඔ ඩර්ශ්න සඳහා 11 . 55අම් - ට හිරු tv බලන්න,update - පස්සර බුෂ් අනතුර නවතම විඩෙඔ ඩර්ශ්න සඳහා 11 . 55අම් - ට හිරු tv බලන්න,Update : පස්සර බස් අනතුරේ නවතම වීඩියෝ දර්ශන සඳහා 11.55  a.m. ට හිරු TV බලන්න
nowana bawata haduna ganeema nisa owun colamba remand bandanagaraya wetha maaru karai,නොවන බවට හඳුනා ගනීම නිසා ඔවුන් කොලඹ remand බඳනගරය වෙත මාරු කරඉ,නොවන බවට හඳුනා ගනීම නිසා ඔවුන් කොළඹ remand නගරය වෙත මාරු කරයි,නොවන බව හඳුනා ගැනීම නිසා ඔවුන් කොළඹ රිමාන්ඩ් බන්ධනාගාරය වෙත මාරු කරයි
bedumkara wanchawata adalawa remand kara sitina ravi karunanayake ethulu 8 dena covid-19 asadithayin,බෙඩුම්කර වන්චවට අඩලව remand කර සිටින රවි කරුනනයකෙ එතුලු 8 ඩෙන covid - 19 අසඩිතයින් ,බැඳුම්කර වන්නට අඩලව remand කර සිටින රවී කරුනනයකෙ ඇතුළු 8 දෙන covid - 19 ආසාධිතයින් ,බැඳුම්කර වංචාවට අදාළව රිමාන්ඩ් කර සිටින රවි කරුණී කරුණානායක ඇතුළු අට දෙනා Covid 19 ආසාධිතයින් 
sinharaja sooriyakanda kandamuduna pradeshaye ruk ropana kriyanwithaya v - force dayakathwayen erambe.,සින්හරජ සූරියකඳ කඳමුඩුන ප්‍රඩෙශයෙ රුක් රොපන ක්‍රියන්විතය v - force ඩයකත්වයෙන් එරඹෙ .,සින්හරජ සූරියකඳ කඳමුඩුන ප්‍රදේශයේ රුක් රෝපණ ක්‍රියන්විතය v - force දායකත්වයෙන් ඇරඹේ .,සිංහරාජ සූරියකන්ද කන්ද මුදුන ප්‍රදේශයේ රුක් රෝපණ රුක්රෝපණ ක්‍රියාන්විතය V-Force දායකත්වයෙන් ඇරඹේ 
ampara pradeshaye sidu kala perashuuta puhunuweemak atharathura sidu wu anathurakin guwan hamuda niladhariyeku miya yai,අම්පර ප්‍රඩෙශයෙ සිදු කල පෙරශූට පුහුනුවීමක් අතරතුර සිදු වු අනතුරකින් ගුවන් හමුඩ නිලඩ්හරියෙකු මිය යඉ,අම්පාර ප්‍රදේශයේ සිදු කල පෙරශූට පුහුණුවීම් අතරතුර සිදු වු අනතුරකින් ගුවන් හමුඩ නිලඩ්හරියෙකු මිය යයි,අම්පාර ප්‍රදේශයේ සිදුකළ පැරෂුට් පුහුණුවීමක් අතරතුර සිදු වූ අනතුරකින් ගුවන් හමුදා නිලධාරියකු මියයයි
update : guwan hamudha samajikayeku miya yai. thawath ayeku thuwala labai. - guwan hamudhawa,update : ගුවන් හමුඩ්හ සමජිකයෙකු මිය යඉ . තවත් අයෙකු තුවල ලබඉ . - ගුවන් හමුඩ්හව,update : ගුවන් හමුඩ්හ සාමාජිකයෙකු මිය යයි . තවත් අයෙකු තුවල ලබයි . - ගුවන් හමුඩ්හව,Update : ගුවන් හමුදා සාමාජිකයෙකු මියයයි. මිය යයි තවත් අයෙකු තුවාල ලබයි -ගුවන් හමුදාව
ampara uhana guwan hamudha kadawure pewathi parashoot puhunuwakadi sidu u anathurakin,අම්පර උහන ගුවන් හමුඩ්හ කඩවුරෙ පෙවති පරශූට් පුහුනුවකඩි සිදු උ අනතුරකින්,අම්පාර උහන ගුවන් හමුඩ්හ කඳවුරේ පෙවති පරශූට් පුහුනුවකඩි සිදු වූ අනතුරකින්,අම්පාර උහන ගුවන් හමුදා කඳවුරේ පැවැති පැරශුට් පුහුණුවකදී සිදු වූ අනතුරකින්
update: passara sidu wu bus ratha anathurin miya giya ganana 13 k ha thuwala lebuuwan ganana 31 dakwa ihalata,update : පස්සර සිදු වු බුස් රත අනතුරින් මිය ගිය ගනන 13 ක් හා තුවල ලෙබූවන් ගනන 31 දක්වා ඉහලට,update : පස්සර සිදු වු බුෂ් රථ අනතුරින් මිය ගිය ගණන 13 ක් හා තුවල ලෙබූවන් ගණන 31 දක්වා ඉහලට,පස්සර සිදු වූ බස් රථ අනතුරින් මියගිය ගණන 13 ක් හා තුවාල ලැබුවන් ගණන 31 ක්  දක්වා ඉහළට.
update-passara bus ratha anathurin miya giya sankyawa 14 dakwa ihalata. thuwala lebu sankyawa 46-disthrik waidya niladari,update - පස්සර බුස් රත අනතුරින් මිය ගිය සන්ක්යව 14 දක්වා ඉහලට . තුවල ලෙබු සන්ක්යව 46 - ඩිස්ත්‍රික් වඉඩ්ය නිලඩරි,update - පස්සර බුෂ් රථ අනතුරින් මිය ගිය සන්ක්යව 14 දක්වා ඉහලට . තුවල ලෙබු සන්ක්යව 46 - දිස්ත්‍රික් වඉඩ්ය නිලඩරි,Update : පස්සර බස් රථ අනතුරෙන් මිය ගිය සංඛ්‍යාව 14 ක් දක්වා ඉහලට .තුවාල ලැබූවන්ගේ සංඛ්‍යාව 46 ක් -දිස්ත්‍රික් වෛද්‍ය නිළධාරි
"update - passara, bus anathuren miyagiya sankyawa 13na dakwa ihalata; thuwala lebu ganana 31k: police spokesman","update - පස්සර , බුස් අනතුරෙන් මියගිය සන්ක්යව 13න දක්වා ඉහලට ; තුවල ලෙබු ගනන 31ක් : police spokesman","update - පස්සර , බුෂ් අනතුරෙන් මියගිය සන්ක්යව 13න දක්වා ඉහලට ; තුවල ලෙබු ගණන 31ක් : police spokesman","Update : පස්සර, බස් අනතුරෙන් මිය ගිය සංගිය සංඛ්‍යාව 13 ක් දක්වා ඉහලට. තුවාල ලැබූ ගණන 32 ක්- Police Spokesman "
athurudan-wu ratmalane paasal sisuwa seveemata vishesha police kandayam 04-k: police spokesman,අතුරුඩන් - වු රට්මලනෙ පාසල් සිසුව සෙවීමට විශේෂ police කඳයම් 04 - ක් : police spokesman,අතුරුදන් - වු රට්මලනෙ පාසල් සිසුව සෙවීමට විශේෂ police කඳයම් 04 - ක් : police spokesman,අතුරුදන්-වූ රත්මලානේ පාසල් සිසුවා සෙවීමට විශේෂ police කණ්ඩායම් 4 ක්- Police Spokesman
v. radhakrishnan-ge nayakathwayen yuth kandurata janatha peramuna niyojanaya karana mp a. aravindh kumar-ge paksha samajikathwaya ahosi kere,v . රඩ්හක්‍රිශ්නන් - ගෙ නයකත්වයෙන් යුත් කඳුරට ජනත පෙරමුන නියොජනය කරන ම්ප් a . අරවිඳ්හ් කුමර් - ගෙ පක්ශ සමජිකත්වය අහොසි කෙරෙ,v . රඩ්හක්‍රිශ්නන් - ගේ නායකත්වයෙන් යුත් කඳවුරට ජනත පෙරමුණ නියොජනය කරන ම්ප් a . අරවිඳ්හ් කුමර් - ගේ පක්ෂ සාමාජිකත්වය අහෝසි කෙරේ,V රාධක්‍රිෂ්ණන්-ගේ නායකත්වයෙන් යුත් කඳුරට ජනතා පෙරමුණ නියෝජනය කරන Mp A.අරවින්ද කුමාර් ගේ පක්ෂ සාමාජිකත්වය අහෝසි කෙරේ 
passara 13 kanuwa pradeshaye dee bus rathayak peralee yamen siduwu anathurakin pudagalayin 7 deneku miya yai. thawath 20 kata thuwala,පස්සර 13 කනුව ප්‍රඩෙශයෙ දී බුස් රතයක් පෙරලී යමෙන් සිඩුවු අනතුරකින් පුඩගලයින් 7 ඩෙනෙකු මිය යඉ . තවත් 20 කට තුවල,පස්සර 13 කනුව ප්‍රදේශයේ දී බුෂ් රථයක් පෙරළී යමෙන් සිදුවූ අනතුරකින් පුද්ගලයින් 7 දෙනෙකු මිය යයි . තවත් 20 කට තුවල,පස්සර 13 කනුව ප්‍රදේශයේ කණුව ප්‍රදේශයේදී බස් රථයක් පෙරළී යාමෙන් සිදු වූ අනතුරකින් පුද්ගලයින් 7 දෙනකු මිය යයි තවත් 20කට තුවාල
"update - passara, 13-kanuwa pradeshaye-di, bus rathayak prapathayakata perali sidu-wu anathuren 07-denek miya-yai; 20-kata thuwala: police spokesman","update - පස්සර , 13 - කනුව ප්‍රඩෙශයෙ - ඩි , බුස් රතයක් ප්‍රපතයකට පෙරලි සිදු - වු අනතුරෙන් 07 - ඩෙනෙක් මිය - යඉ ; 20 - කට තුවල : police spokesman","update - පස්සර , 13 - කනුව ප්‍රදේශයේ - ඩි , බුෂ් රථයක් ප්‍රපතයකට පෙරළී සිදු - වු අනතුරෙන් 07 - දෙනෙක් මිය - යයි ; 20 - කට තුවල : police spokesman",Update : පස්සට 13 කනුව ප්‍රදේශයේ කණුව ප්‍රදේශයේදී බස් රථයක් ප්‍රපාතයකට  පෙරළී සිදු වූ අනතුරෙන් හත් දෙනෙක් මියයයි විස්සකට තුවාල - Police Spokesman 
update :lunugala sita colomba bala dhawanaya u bus rathyak passara 13 kanuwa pradeshayedi prapathyakata peralimen 07k maruta. thawath 20k thuwala. - police,update : ලුනුගල සිට කොලොඹ බොල ඩ්හවනය උ බුස් රත්යක් පස්සර 13 කනුව ප්‍රඩෙශයෙඩි ප්‍රපත්යකට පෙරලිමෙන් 07ක් මරුට . තවත් 20ක් තුවල . - police,update : ලුනුගල සිට කොලොඹ බොල ඩ්හවනය උ බුෂ් රත්යක් පස්සර 13 කනුව ප්‍රදේශයේදී ප්‍රපත්යකට පෙරළිමෙන් 07ක් මරුට . තවත් 20ක් තුවල . - police,Update : ලුනුගල සිට කොළඹ බලා ධාවනය වූ බස් රථයක් පස්සට 13 කනුව ප්‍රදේශයේ දී ප්‍රපාතයකට පෙරළීමෙන් හතක් මරුට තවත් විස්සකට තුවාල - Police
