singlish_news,transliterated_l1,transliterated_l2,man_written
update-bangladesh rajya sancharaya arabamin dhaka  aganuwarata pemini agramathya mahinda rajapaksha erata agamethiniya wisin piliganu labai,update - බඟ්ලඩෙශ් රජ්ය සන්චරය අරබමින් ඩ්හක අගනුවරට පෙමිනි අග්‍රාමාත්‍ය මහින්ද රජපක්ශ එරට අගමෙතිනිය විසින් පිලිගනු ලබඉ,update - බඟ්ලඩෙශ් රජ්ය සන්චරය කරමින් ඩ්හක අගනුවරට පෙමිනි අග්‍රාමාත්‍ය මහින්ද රාජපක්ෂ එරට අගමෙතිනිය විසින් පිලිගනු ලබයි,Update : බංග්ලාදේශ් රජය සාකච්ඡා අරඹමින් ඩකා අගනුවරට පැමිණි අග්‍රාමාත්‍ය මහින්ද රාජපක්ෂ එරට අගමැති විසින් පිළිගනු ලබයි 
amathya rohitha abeygunawardanata erehi allas comisame naduwe chodana walin ohu nidahas kirimata colamba mahadikaranayen niyoga,අමත්ය රොහිත අබෙය්ගුනවර්ඩනට එරෙහි අල්ලස් කොමිසමෙ නඩුවෙ චොඩන වලින් ඔහු නිඩහස් කිරිමට කොලඹ මහඩිකරනයෙන් නියොග,අමතකය රෝහිත අබෙය්ගුනවර්ඩනට එරෙහි අල්ලස් කොමිසම නඩුවෙ චොඩන වලින් ඔහු නිදහස් කිරිමට කොළඹ මහඩිකරනයෙන් නියෝග,අමාත්‍ය රෝහිත අබේගුණවර්ධන ට එරෙහි අල්ලස් කොමිසමේ නඩුවේ චෝදනාවලින් ඔහු නිදහස් කිරීමට කොළඹ මහාධිකරණයෙන් නියෝග
agramathya mahinda rajapaksa dedina raajya sancharayak sadaha bangladeshaya balaa pitathwa yai,අග්‍රාමාත්‍ය මහින්ද රජපක්ස ඩෙඩින රාජ්ය සන්චරයක් සඳහා බඟ්ලඩෙශය බලා පිටත්ව යඉ,අග්‍රාමාත්‍ය මහින්ද රාජපක්ෂ දෙදින රාජ්ය සන්චරයක් සඳහා බඟ්ලඩෙශය බලා පිටත්ව යයි,"අග්‍රාමාත්‍ය මහින්ද රාජපක්ෂ දෙදින රාජ්‍ය සංචාරයක් සඳහා බංග්ලාදේශය බලා පිටත්ව යයි"
"update: dedina raajya sancharaya aramba karamin dhaka aganuwara wetha giya agamethi mahinda rajapaksa, bangladesha agamethi sheikh hasina wisin piliganee","update : ඩෙඩින රාජ්ය සන්චරය අරඹ කරමින් ඩ්හක අගනුවර වෙත ගිය අගමෙති මහින්ද රජපක්ස , බඟ්ලඩෙශ අගමෙති ශෙඉක්හ් හසින විසින් පිලිගනී","update : දෙදින රාජ්ය සන්චරය අරඹ කරමින් ඩ්හක අගනුවර වෙත ගිය අගමැති මහින්ද රාජපක්ෂ , බඟ්ලඩෙශ අගමැති ශෙඉක්හ් හසින විසින් පිලිගනී",Update : දෙදින රාජ්‍ය සංචාරය ආරම්භ කරමින් ඩකා අගනුවර වෙත ගිය අගමැති මහින්ද රාජපක්ෂ බංගලාදේශ අගමැති ෂික් හසීනා විසින් පිළිගනී 
update: bangladeshaye dedina raajya sancharaya arabamin dhaka aganuwarata pemini agamethi mahinda rajapaksa erata agamethiniya wisin piligani,update : බඟ්ලඩෙශයෙ ඩෙඩින රාජ්ය සන්චරය අරබමින් ඩ්හක අගනුවරට පෙමිනි අගමෙති මහින්ද රජපක්ස එරට අගමෙතිනිය විසින් පිලිගනි,update : බඟ්ලඩෙශයෙ දෙදින රාජ්ය සන්චරය කරමින් ඩ්හක අගනුවරට පෙමිනි අගමැති මහින්ද රාජපක්ෂ එරට අගමෙතිනිය විසින් පිලිගනි,Update : බංග්ලාදේශයේ දෙදින රාජ්‍ය සංචාරය අරමුණින් ඩකා අගනුවරට පැමිණි අගමැති මහින්ද රාජපක්ෂ එරට අග්‍රාමාත්‍ය විසින් පිළිගනී
"sabaragamuwa, dakuna, basnahira, madyama ha wayamba palathwala ethem sthanawalata 100mm wedi thada warshawak ethiwiya heki-met dept","සබරගමුව , ඩකුන , බස්නහිර , මඩ්යම හා වයඹ පලත්වල එතෙම් ස්තනවලට 100ම්ම් වැඩි තඩ වර්ශවක් එතිවිය හෙකි - මෙට් ඩෙප්ට්","සබරගමුව , දකුණ , බස්නාහිර , මඩ්යම හා වයඹ පත්ව එතෙම් ස්ථානවලට 100ම්ම් වැඩි තද වර්ණවත් ඇතිවිය හෙකි - මෙට් ඩෙප්ට්","සබරගමුව ,දකුණ  ,බස්නාහිර මධ්‍යම හා වයඹ පළාත් වල ඇතැම් ස්ථාන වලට 100 mm වැඩි තද වර්ෂාවක් ඇති විය හැක - Met dept"
update-bangladesh rajya sancharaya arabamin dhaka  aganuwarata pemini agramathya mahinda rajapaksha erata agamethiniya wisin piliganu labai,update - බඟ්ලඩෙශ් රජ්ය සන්චරය අරබමින් ඩ්හක අගනුවරට පෙමිනි අග්‍රාමාත්‍ය මහින්ද රජපක්ශ එරට අගමෙතිනිය විසින් පිලිගනු ලබඉ,update - බඟ්ලඩෙශ් රජ්ය සන්චරය කරමින් ඩ්හක අගනුවරට පෙමිනි අග්‍රාමාත්‍ය මහින්ද රාජපක්ෂ එරට අගමෙතිනිය විසින් පිලිගනු ලබයි,Update : බංගලාදේශ රාජ්‍ය සංචාරය අරඹමින් ඩකා අගනුවරට පැමිණි අග්‍රාමාත්‍ය මහින්ද රාජපක්ෂ එරට අග්‍රාමාත්‍ය විසින් පිළිගනු ලබයි
"dedina nila sancharayak sadaha, agamathi mahinda rajapakse bangladeshaya bala pitathwa-yai","ඩෙඩින නිල සන්චරයක් සඳහා , අගමති මහින්ද රජපක්සෙ බඟ්ලඩෙශය බොල පිටත්ව - යඉ","දෙදින නිල සන්චරයක් සඳහා , අගමැති මහින්ද රජපක්සෙ බඟ්ලඩෙශය බොල පිටත්ව - යයි",දෙදින නිල සංචාරයක් සඳහා අගමැති මහින්ද රාජපක්ෂ බංගලාදේශයේ බලා පිටත්ව යයි
thawath corona asadithain 140k.ada dina warthawu asadithain sankayawa 302k.-rajaye prawruthi departhamenthuwa,තවත් කොරෝනා ආසාධිතයින් 140ක් . අඩ ඩින වාර්තාවු ආසාධිතයින් සන්කයව 302ක් .- රජයෙ ප්‍රවෘත්ති දෙපාර්තමේන්තුව,තවත් කොරෝනා ආසාධිතයින් 140ක් . අද දින වාර්තාවු ආසාධිතයින් සන්තකයේ 302ක් .- රජයේ ප්‍රවෘත්ති දෙපාර්තමේන්තුව,තවත් කොරෝනා ආසාධිතයින් එකසිය හතලිහක්. අද දින වාර්තා වූ ආසාධිතයින් සංඛ්‍යාව 302 ක් -රජයේ ප්‍රවෘත්ති දෙපාර්තමේන්තුව
update: covid-19 asadithayin 140 deneku haduna ganne.ada wartha wu asadithayin ganana 302 dakwa ihalata - yuda hamudapathi,update : covid - 19 අසඩිතයින් 140 ඩෙනෙකු හඳුනා ගන්නෙ . අඩ වාර්තා වු අසඩිතයින් ගනන 302 දක්වා ඉහලට - යුඩ හමුඩපති,update : covid - 19 ආසාධිතයින් 140 දෙනෙකු හඳුනා ගන්නේ . අද වාර්තා වු ආසාධිතයින් ගණන 302 දක්වා ඉහලට - යුද හමුදාපති,"Update : Covid 19 ආසාධිතයින් 140 දෙනෙකු හඳුනා ගැනේ. අද වාර්තා වූ වූ ආසාධිතයින් ගණන තුන්සිය දෙකක් දක්වා ඉහලට-යුද හමුදා පති "
"thawath corona marana 01k wartha wei.marana sankayawa 538 dakwa ihalata.-saukya sewa adhyaksha genaral.",තවත් කොරෝනා මරන 01ක් වාර්තා වෙඉ . මරන සන්කයව 538 දක්වා ඉහලට .- සෞඛ්‍ය සෙව අඩ්හ්යක්ශ ගෙනරල් .,තවත් කොරෝනා මරණ 01ක් වාර්තා වෙයි . මරණ සන්තකයේ 538 දක්වා ඉහලට .- සෞඛ්‍ය සෙව අඩ්හ්යක්ශ ගෙනරල් .,තවත් කොරෝනා මරණ එකක් වාර්තා වාර්තාවෙයි මරණ සංඛ්‍යාව 538 ක් දක්වා ඉහලට- සෞඛ්‍ය සේවා අධ්‍යක්ෂ ජනරාල්
covid-19 asaditha maranayak wartha weemath samaga merata samastha marana 538 dakwa ihalata - saukya amathyanshaya,covid - 19 අසඩිත මරනයක් වාර්තා වීමත් සමග මෙරට සමස්ත මරන 538 දක්වා ඉහලට - සෞඛ්‍ය අමාත්‍යාංශය,covid - 19 අසිත රථයක් වාර්තා වීමත් සමග මෙරට සමස්ත මරණ 538 දක්වා ඉහලට - සෞඛ්‍ය අමාත්‍යාංශය,"Covid 19 ආසාධිත මරණයක් වාර්තා වීමත් වාර්තා වීමත් සමග මෙරට සමස්ත මරණ 538 ක් දක්වා ඉහළට - සෞඛ්‍ය අමාත්‍යාංශය"
thawath covid-19 marana 01k wartha-wei; merata samastha marana 538 dakwa ihalata.: information department,තවත් covid - 19 මරන 01ක් වාර්තා - වෙඉ ; මෙරට සමස්ත මරන 538 දක්වා ඉහලට .: information department,තවත් covid - 19 මරණ 01ක් වාර්තා - වෙයි ; මෙරට සමස්ත මරණ 538 දක්වා ඉහලට . : information department,තවත් covid 19 මරණයක් වාර්තා වෙයි. මෙරට සමස්ත මරණ 538 දක්වා ඉහලට- information department
bangladesh agamethiniyage aradanawakata anuwa agamethi mahinda rajapaksa heta ha anidda bangladesh sancharayaka-agramathya karyalaya,බඟ්ලඩෙශ් අගමෙතිනියගෙ අරඩනවකට අනුව අගමෙති මහින්ද රජපක්ස හෙට හා අනිඩ්ඩ බඟ්ලඩෙශ් සන්චරයක - අග්‍රාමාත්‍ය කර්යලය,බඟ්ලඩෙශ් අගමෙතිනියගෙ අරඩනවකට අනුව අගමැති මහින්ද රාජපක්ෂ හෙට හා අනිඩ්ඩ බඟ්ලඩෙශ් සන්චරයක - අග්‍රාමාත්‍ය කාර්යාලය,බංග්ලාදේශ් අගමැතිනියගේ ආරාධනාවකට අනුව අගමැති මහින්ද රාජපක්ෂ හෙට හා අනිද්දා බංගලාදේශ් සංචාරයක- අග්‍රාමාත්‍ය කාර්යාලය
"covid-19 asadithayin 219 deneku suwaya labai.merata suwaya labaa rohalwalin pitawa giya samastha ganana 85,944 dakwa ihalata - saukya amathyanshaya","covid - 19 අසඩිතයින් 219 ඩෙනෙකු සුවය ලබඉ . මෙරට සුවය ලබා රොහල්වලින් පිටව ගිය සමස්ත ගනන 85 , 944 දක්වා ඉහලට - සෞඛ්‍ය අමාත්‍යාංශය","covid - 19 ආසාධිතයින් 219 දෙනෙකු සුවය ලබයි . මෙරට සුවය ලබා රෝහල්වලින් පිටව ගිය සමස්ත ගණන 85 , 944 දක්වා ඉහලට - සෞඛ්‍ය අමාත්‍යාංශය","Covid 19 ආසාධිතයින් 219 දෙනෙකු සුවය ලබයි. මෙරට සුවය ලබා රෝහල්වලින් පිටව ගිය සමස්ත ගණන 85,944 දක්වා ඉහලට -සෞඛ්‍ය අමාත්‍යාංශය"
thawath corona asadithain 162k hadhuna gane .-rajaye prawruthi departhamenthuwa,තවත් කොරෝනා ආසාධිතයින් 162ක් හඩ්හුන ගනෙ .- රජයෙ ප්‍රවෘත්ති දෙපාර්තමේන්තුව,තවත් කොරෝනා ආසාධිතයින් 162ක් හඩ්හුන ගනෙ .- රජයේ ප්‍රවෘත්ති දෙපාර්තමේන්තුව,"තවත් corona කොරෝනා ආසාධිතයින් 162ක් හඳුනා ගැනේ- රජයේ ප්‍රවෘත්ති දෙපාර්තමේන්තුව "
covid-19 asadithayin 162 deneku haduna ganne - yuda hamudapathi,covid - 19 අසඩිතයින් 162 ඩෙනෙකු හඳුනා ගන්නෙ - යුඩ හමුඩපති,covid - 19 ආසාධිතයින් 162 දෙනෙකු හඳුනා ගන්නේ - යුද හමුදාපති,"Covid 19 ආසාධිතයින් 162 දෙනෙකු හඳුනා ගැනේ-යුද හමුදාපති "
thawath covid-19 asadithayin 162k wartha wei.: army commander,තවත් covid - 19 අසඩිතයින් 162ක් වාර්තා වෙඉ .: army commander,තවත් covid - 19 ආසාධිතයින් 162ක් වාර්තා වෙයි . : army commander,තවත් Covid 19 ආසාධිතයින් 162 ක් වාර්තා වාර්තාවෙයි- army commander 
wisin nikuth karai.thorathuru sadaha piwisenna- adaderana.lk,විසින් නිකුත් කරඉ . තොරතුරු සඳහා පිවිසෙන්න - අඩඩෙරන . ල්ක්,විසින් නිකුත් කරයි . තොරතුරු සඳහා පිවිසෙන්න - adaderana.lk,විසින් නිකුත් කරයි. තොරතුරු සඳහා පිවිසෙන්න -adaderana.lk 
videsgathawa sita peminena pudgalayin sadaha nawa covid-19 margopadesha saukya sewa adyaksha general,විඩෙස්ගතව සිට පෙමිනෙන පුඩ්ගලයින් සඳහා නව covid - 19 මර්ගොපඩෙශ සෞඛ්‍ය සෙව අධ්‍යක්ෂ general ,විදෙස්ගතව සිට පෙමිනෙන පුද්ගලයින් සඳහා නව covid - 19 මර්ගොපඩෙශ සෞඛ්‍ය සෙව අධ්‍යක්ෂ general ,විදේශගතව සිට පැමිණෙන පුද්ගලයන් සඳහා නව Covid 19 මාර්ගෝපදේශ- සෞඛ්‍ය සේවා අධ්‍යක්ෂ ජනරාල්
rajitha senaratne ha chathura senaratne gen prakasha satahan kara ganeemata niyamithai - police maadya prakashaka,රජිත සෙනරට්නෙ හා චතුර සෙනරට්නෙ ගෙන් ප්‍රකශ සටහන් කර ගනීමට නියමිතඉ - police මාඩ්ය ප්‍රකශක,රජිත සෙනරට්නෙ හා චතුර සෙනරට්නෙ ගෙන් ප්‍රකශ සටහන් කර ගැනීමට නියමිතය - police මාඩ්ය ප්‍රකශක,රාජිත සේනාරත්න හා චතුර සේනාරත්න ගෙන් ප්‍රකාශ සටහන් කර ගැනීමට නියමිතයි- police මාධ්‍ය ප්‍රකාශක 
thama paharagath bawata sawadya peminillak demuu maadyawediyata sambanda wimarshanawalata adalawa colamba aparada kottashaya,තම පහරගත් බවට සවඩ්ය පෙමිනිල්ලක් ඩෙමූ මාඩ්යවෙඩියට සඹඳ විමර්ශනවලට අඩලව කොලඹ අපරඩ කොට්ටශය ,තම කරගත් බවට සවඩ්ය පැමිණිල්ලක් දෙමු මාඩ්යවෙඩියට සඹඳ විමර්ශනවලට අඩලව කොළඹ අපරඩ කොට්ඨාශය ,තමා පැහැර ගත් බවට සාවද්‍ය පැමිණිල්ලක් දැමූ මාධ්‍යවේදියාට සම්බන්ධ විමර්ශනවලට අදාළව කොළඹ අපරාධ කොට්ඨාශය 
"vides ratawala sita diwainata peminena sancharakain sandaha wana nirodayana piyawara ethulath chakralekaya nikuth kere, piwisenna newsfirst.lk wetha","විඩෙස් රටවල සිට ඩිවඉනට පෙමිනෙන සන්චරකඉන් සඳහා වන නිරොඩයන පියවර එතුලත් චක්‍රලෙකය නිකුත් කෙරෙ , පිවිසෙන්න newsfirst.lk වෙත","විදෙස් රටවල සිට දිවයිනට පෙමිනෙන සන්චරකඉන් සඳහා වන නිරොඩයන පියවර ඇතුළත් චක්‍රලෙකය නිකුත් කෙරේ , පිවිසෙන්න newsfirst.lk වෙත",විදෙස් රටවල සිට දිවයිනට පැමිණෙන සංචාරකයන් සඳහා වන නිරෝධායන පියවර ඇතුලත් චක්‍රලේඛය නිකුත් කෙරේ. පිවිසෙන්න newsfirst.lk වෙත
"ada aluyama lankawata regenawith athi dehaya dinuka nohoth dinuka madushangeda  yanna soya genimata dna parikshanayak.-police madhya prakashaka",අඩ අලුයම ලන්කවට රෙගෙනවිත් ඇති ඩෙහය ඩිනුක නොහොත් ඩිනුක මඩුශඟෙඩ යන්න සොය ගෙනිමට dna පරික්ශනයක් .- police මඩ්හ්ය ප්‍රකශක,අද අලුයම ලංකාවට රැගෙනවිත් ඇති දේහය ඩිනුක නොහොත් ඩිනුක මඩුශඟෙඩ යන්න සොය ගැනිමට dna පරීක්ෂණයක් .- police මඩ්හ්ය ප්‍රකශක,අද අලුයම ලංකාවට රැගෙනවිත් ඇති දේහය දිනුක නොහොත් දිනුක මධුෂාන් ගෙදර යන්න සොයා ගැනීමට DNA පරීක්ෂණයක්- police මාධ්‍ය ප්‍රකාශක
ehi ananyathawa thahawuru kara ganeema sadaha policiya dna sampala ha egili salakunu labaa ganee,එහි අනන්යතව තහවුරු කර ගනීම සඳහා පොලිකිය dna සම්පල හා එගිලි සලකුනු ලබා ගනී,එහි අනන්යතව තහවුරු කර ගනීම සඳහා පොලිසිය dna සාම්පල හා ඇඟිලි සළකුණු ලබා ගනී,එහි අනන්‍යතාවය තහවුරු කරගැනීම කරගැනීම සඳහා පොලිසිය DNA ඒ සාම්පල හා ඇඟිලි සලකුණු ලබා ගනී
"dubai hidee miya giya aparada kalli samajika ""keselwatte dinuka"" ge mrutha dehaya sri lankawata ragena ei","ඩුබඉ හිඩී මිය ගිය අපරඩ කල්ලි සමජික "" කෙසෙල්වට්ටෙ ඩිනුක "" ගෙ මෘත ඩෙහය sri ලන්කවට රගෙන එඉ ",ඩුබඉ හිදී මිය ගිය අපරඩ කල්ලි සමාජික `` කෙසෙල්වට්ටෙ ඩිනුක `` ගේ මෘත දේහය sri ලන්කන් රගෙන අයි ,"ඩුබායිහි දී මියගිය අපරාධ කල්ලි සාමාජික ""කෙසෙල්වත්තේ දිනුක"" ගේ මෘත දේහය ශ්‍රී ලංකාවට රැගෙන එයි"
"covid-19 nisa rekiya ahimi-wu paudgalika anshaye sewakainta, e-pilibandawa denum denna 0112 368 502, irlabur456'gmail.com - ministry of labour","covid - 19 නිසා රෙකිය අහිමි - වු පෞඩ්ගලික අන්ශයෙ සෙවකඉන්ට , ඒ - පිලිබඳව ඩෙනුම් ඩෙන්න 0112 368 502 , ඉර්ලබුර්456 ' ග්මඉල් . කොම් - ministry of ලබොඋර්","covid - 19 නිසා රෙකිය අහිමි - වු පෞද්ගලික අංශයේ සේවකයන්ට , ඒ - පිළිබඳ ඩෙනුම් දෙන්න 0112368502,irlabur456'gmail.com- Ministry of Labour","Covid 19 නිසා රැකියා අහිමි වූ පුද්ගලික අංශයේ සේවකයන්ට, ඒ පිළිබඳ දැනුම් දෙන්න 0112368502,irlabur456'gmail.com- Ministry of Labour"
